section_number,title,division,word_count,headline,prediction_short,fraction_ai,fraction_ai_assisted,fraction_human,total_segments,num_ai_segments,num_ai_assisted_segments,num_human_segments,reliability
722,Cooperation with eligible entities,"Organization, Authorities, Acquisition, and Personnel of the Coast Guard",953,Fully Human Written,Human,0.0000,0.0000,1.0000,3,0,0,3,medium
7231,Behavioral health,"Organization, Authorities, Acquisition, and Personnel of the Coast Guard",1357,Fully Human Written,Human,0.0000,0.0000,1.0000,4,0,0,4,medium
7232,Travel allowance for members of Coast Guard assigned to Alaska,"Organization, Authorities, Acquisition, and Personnel of the Coast Guard",438,Fully Human Written,Human,0.0000,0.0000,1.0000,2,0,0,2,low
7233,Tuition assistance and advanced education assistance pilot program,"Organization, Authorities, Acquisition, and Personnel of the Coast Guard",429,Fully Human Written,Human,0.0000,0.0000,1.0000,2,0,0,2,low
7234,"Recruitment, relocation, and retention incentive program for civilian firefighters employed by Coast Guard remote locations","Organization, Authorities, Acquisition, and Personnel of the Coast Guard",333,,Human,0.0000,0.0000,1.0000,1,0,0,1,low
7235,Notification,"Organization, Authorities, Acquisition, and Personnel of the Coast Guard",273,,Human,0.0000,0.0000,1.0000,0,0,0,0,low
7241,Modification of reporting requirements on covered misconduct in Coast Guard Academy; consideration of request for transfer of a cadet at the Coast Guard Academy who is the victim of a sexual assault or related offense; room reassignment,"Organization, Authorities, Acquisition, and Personnel of the Coast Guard",2833,Fully Human Written,Human,0.0000,0.0000,1.0000,8,0,0,8,high
7242,Modification of Board of Visitors,"Organization, Authorities, Acquisition, and Personnel of the Coast Guard",1604,Fully Human Written,Human,0.0000,0.0000,1.0000,5,0,0,5,medium
7243,Coast Guard Academy Cadet Advisory Board,"Organization, Authorities, Acquisition, and Personnel of the Coast Guard",727,Fully Human Written,Human,0.0000,0.0000,1.0000,2,0,0,2,low
7244,Authorization for use of Coast Guard Academy facilities and equipment by covered foundations,"Organization, Authorities, Acquisition, and Personnel of the Coast Guard",512,Fully Human Written,Human,0.0000,0.0000,1.0000,2,0,0,2,low
7247,Study on Coast Guard Academy oversight,"Organization, Authorities, Acquisition, and Personnel of the Coast Guard",307,Fully Human Written,Human,0.0000,0.0000,1.0000,1,0,0,1,low
7248,Electronic locking mechanisms to ensure Coast Guard Academy cadet room security,"Organization, Authorities, Acquisition, and Personnel of the Coast Guard",517,Fully Human Written,Human,0.0000,0.0000,1.0000,2,0,0,2,low
7252,Review and modification of Coast Guard Academy policy on sexual harassment and sexual violence,"Organization, Authorities, Acquisition, and Personnel of the Coast Guard",697,Fully Human Written,Human,0.0000,0.0000,1.0000,2,0,0,2,low
7261,"Policy and briefing on availability of naloxone to treat opioid, including Fentanyl, overdoses","Organization, Authorities, Acquisition, and Personnel of the Coast Guard",659,Fully Human Written,Human,0.0000,0.0000,1.0000,2,0,0,2,low
7263,Plan for joint and integrated maritime operational and leadership training for United States Coast Guard and Taiwan Coast Guard administration,"Organization, Authorities, Acquisition, and Personnel of the Coast Guard",436,Fully Human Written,Human,0.0000,0.0000,1.0000,2,0,0,2,low
7264,Aids to navigation,"Organization, Authorities, Acquisition, and Personnel of the Coast Guard",1181,AI Detected,Mixed,0.4659,0.0000,0.5341,4,2,0,2,medium
7265,Study and gap analysis with respect to Coast Guard Air Station Corpus Christi aviation hanger,"Organization, Authorities, Acquisition, and Personnel of the Coast Guard",402,Fully Human Written,Human,0.0000,0.0000,1.0000,1,0,0,1,low
7267,Report on Junior Reserve Officers’ Training Corps program,"Organization, Authorities, Acquisition, and Personnel of the Coast Guard",574,Fully Human Written,Human,0.0000,0.0000,1.0000,2,0,0,2,low
7271,Report on Coast Guard search and rescue operations,"Organization, Authorities, Acquisition, and Personnel of the Coast Guard",540,Fully Human Written,Human,0.0000,0.0000,1.0000,2,0,0,2,low
7301,Merchant mariner credentialing,Shipping and Navigation,3252,Fully Human Written,Human,0.0000,0.0000,1.0000,12,0,0,12,high
7315,Training,Shipping and Navigation,272,,Human,0.0000,0.0000,1.0000,1,0,0,1,low
7512,Requirements of electronic merchant mariner credentialing system,Shipping and Navigation,371,,Human,0.0000,0.0000,1.0000,1,0,0,1,low
7317,Study of amphibious vessels,Shipping and Navigation,291,Fully Human Written,Human,0.0000,0.0000,1.0000,1,0,0,1,low
731,Improvement of availability of care for veterans from facilities and providers of the Department of Defense,Health Care Provisions,1525,Fully Human Written,Human,0.0000,0.0000,1.0000,4,0,0,4,medium
7321,Ports and waterways safety,Shipping and Navigation,1031,Fully Human Written,Human,0.0000,0.0000,1.0000,4,0,0,4,medium
7322,Study on Bering Strait vessel traffic projections and emergency response posture at ports of the United States,Shipping and Navigation,732,Fully Human Written,Human,0.0000,0.0000,1.0000,2,0,0,2,low
7323,Improving vessel traffic service monitoring,Shipping and Navigation,447,Fully Human Written,Human,0.0000,0.0000,1.0000,2,0,0,2,low
732,Prohibition on painful research on domestic cats and dogs,Health Care Provisions,312,,Human,0.0000,0.0000,1.0000,1,0,0,1,low
733,Pilot program on wastewater surveillance system of Department of Defense,Health Care Provisions,233,,Human,0.0000,0.0000,1.0000,0,0,0,0,low
735,Study on accreditation of military dental treatment facilities,Health Care Provisions,231,,AI,1.0000,0.0000,0.0000,1,1,0,0,low
737,Study on psychological effects of and mental health effects of unmanned aircraft systems in combat operations,Health Care Provisions,361,,AI,1.0000,0.0000,0.0000,1,1,0,0,low
7331,Pilot program for governance and oversight of small uncrewed maritime systems,Shipping and Navigation,335,,Human,0.0000,0.0000,1.0000,1,0,0,1,low
7332,Coast Guard training course,Shipping and Navigation,359,,Human,0.0000,0.0000,1.0000,0,0,0,0,low
7335,Uncrewed systems capabilities report,Shipping and Navigation,549,Fully Human Written,Human,0.0000,0.0000,1.0000,2,0,0,2,low
7337,National Academy of Sciences report on uncrewed systems and use of data,Shipping and Navigation,409,Fully Human Written,Human,0.0000,0.0000,1.0000,2,0,0,2,low
7342,Clarification of authorities,Shipping and Navigation,439,Fully Human Written,Human,0.0000,0.0000,1.0000,2,0,0,2,low
7347,Abandoned and derelict vessel removals,Shipping and Navigation,1073,Fully Human Written,Human,0.0000,0.0000,1.0000,4,0,0,4,medium
734,Pilot program to assist certain members of the Armed Forces and dependents with additional supplemental coverage relating to cancer,Health Care Provisions,716,Fully Human Written,Human,0.0000,0.0000,1.0000,2,0,0,2,low
736,Study on prevalence and mortality of cancer among military rotary-wing pilots and aviation support personnel,Health Care Provisions,617,Fully Human Written,Human,0.0000,0.0000,1.0000,2,0,0,2,low
7401,Vessel response plans,Oil Pollution Response,507,Fully Human Written,Human,0.0000,0.0000,1.0000,2,0,0,2,low
7407,International maritime oil spill response,Oil Pollution Response,232,Fully Human Written,Human,0.0000,0.0000,1.0000,1,0,0,1,low
7501,Independent review of Coast Guard reforms,Sexual Assault and Sexual Harassment Response,407,Fully Human Written,Human,0.0000,0.0000,1.0000,2,0,0,2,low
7502,Coast Guard implementation of independent review commission recommendations on addressing sexual assault and sexual harassment in the military,Sexual Assault and Sexual Harassment Response,445,Fully Human Written,Human,0.0000,0.0000,1.0000,2,0,0,2,low
7511,Covered misconduct,Sexual Assault and Sexual Harassment Response,7204,Fully Human Written,Human,0.0000,0.0000,1.0000,21,0,0,21,high
7512,Policy relating to care and support of victims of covered misconduct,Sexual Assault and Sexual Harassment Response,510,Fully Human Written,Human,0.0000,0.0000,1.0000,2,0,0,2,low
7513,"Flag officer review of, and concurrence in, separation of members who have reported covered misconduct",Sexual Assault and Sexual Harassment Response,568,Fully Human Written,Human,0.0000,0.0000,1.0000,2,0,0,2,low
7515,Training and education programs for covered misconduct prevention and response,Sexual Assault and Sexual Harassment Response,1053,Fully Human Written,Human,0.0000,0.0000,1.0000,3,0,0,3,medium
7522,Development of policies on military protective orders,Sexual Assault and Sexual Harassment Response,266,Fully Human Written,Human,0.0000,0.0000,1.0000,1,0,0,1,low
7523,Establishment of special victim capabilities to respond to allegations of certain special victim offenses,Sexual Assault and Sexual Harassment Response,550,Fully Human Written,Human,0.0000,0.0000,1.0000,2,0,0,2,low
7526,Report on policy on whistleblower protections,Sexual Assault and Sexual Harassment Response,643,Fully Human Written,Human,0.0000,0.0000,1.0000,2,0,0,2,low
7527,Coast Guard and Coast Guard Academy access to defense sexual assault incident database,Sexual Assault and Sexual Harassment Response,413,Fully Human Written,Human,0.0000,0.0000,1.0000,2,0,0,2,low
7528,Expedited transfer in cases of sexual misconduct or domestic violence,Sexual Assault and Sexual Harassment Response,794,Fully Human Written,Human,0.0000,0.0000,1.0000,3,0,0,3,medium
7529,Access to temporary separation program for victims of alleged sex-related offenses,Sexual Assault and Sexual Harassment Response,397,Fully Human Written,Human,0.0000,0.0000,1.0000,2,0,0,2,low
7601,"Comptroller General report on Coast Guard research, development, and innovation program",Comptroller General Reports,438,Fully Human Written,Human,0.0000,0.0000,1.0000,2,0,0,2,low
7602,"Comptroller General study on vessel traffic service center employment, compensation, and retention",Comptroller General Reports,490,Fully Human Written,Human,0.0000,0.0000,1.0000,2,0,0,2,low
7603,Comptroller General review of quality and availability of Coast Guard behavioral health care and resources for personnel wellness,Comptroller General Reports,616,Fully Human Written,Human,0.0000,0.0000,1.0000,2,0,0,2,low
7604,Comptroller General study on Coast Guard efforts to reduce prevalence of missing or incomplete medical records and sharing of medical data with Department of Veterans Affairs and other entities,Comptroller General Reports,361,,Human,0.0000,0.0000,1.0000,1,0,0,1,low
7609,Comptroller General study on athletic coaching at Coast Guard Academy,Comptroller General Reports,307,,Human,0.0000,0.0000,1.0000,0,0,0,0,low
7610,Comptroller General study and report on permanent change of station process,Comptroller General Reports,276,,Human,0.0000,0.0000,1.0000,1,0,0,1,low
7605,Comptroller General study on Coast Guard training facility infrastructure,Comptroller General Reports,462,Fully Human Written,Human,0.0000,0.0000,1.0000,2,0,0,2,low
7606,Comptroller General study on facility and infrastructure needs of Coast Guard stations conducting border security operations,Comptroller General Reports,498,Fully Human Written,Human,0.0000,0.0000,1.0000,2,0,0,2,low
7607,Comptroller General study on Coast Guard basic allowance for housing,Comptroller General Reports,496,Fully Human Written,Human,0.0000,0.0000,1.0000,2,0,0,2,low
7608,Comptroller General report on safety and security infrastructure at Coast Guard Academy,Comptroller General Reports,579,Fully Human Written,Human,0.0000,0.0000,1.0000,2,0,0,2,low
7611,Comptroller General review of Coast Guard Investigative Service,Comptroller General Reports,644,Fully Human Written,Human,0.0000,0.0000,1.0000,2,0,0,2,low
7,Jurisdiction of State of North Carolina,Other Matters,235,,Human,0.0000,0.0000,1.0000,1,0,0,1,low
8804,"Drinking water well replacement for Chincoteague, Virginia",Other Matters,278,,Human,0.0000,0.0000,1.0000,1,0,0,1,low
8805,Briefing on implementation of Compact of Free Association Amendments Act of 2024 with respect to veterans in the Freely Associated States,Other Matters,236,,Human,0.0000,0.0000,1.0000,1,0,0,1,low
801,Prohibition on investments,Prohibition and notification on investments relating to covered national security transactions,628,Fully Human Written,Human,0.0000,0.0000,1.0000,2,0,0,2,low
802,Notification on investments,Prohibition and notification on investments relating to covered national security transactions,491,Fully Human Written,Human,0.0000,0.0000,1.0000,2,0,0,2,low
803,Pilot program for financing for covered activities,"Acquisition Policy, Acquisition Management, and Related Matters",690,Fully Human Written,Human,0.0000,0.0000,1.0000,2,0,0,2,low
803,Report,Prohibition and notification on investments relating to covered national security transactions,979,Fully Human Written,Human,0.0000,0.0000,1.0000,3,0,0,3,medium
804,Multilateral engagement and coordination,Prohibition and notification on investments relating to covered national security transactions,439,Fully Human Written,Human,0.0000,0.0000,1.0000,2,0,0,2,low
804,Multiyear procurement authority for covered systems and certain munitions,"Acquisition Policy, Acquisition Management, and Related Matters",1158,Fully Human Written,Human,0.0000,0.0000,1.0000,4,0,0,4,medium
805,Addressing insufficiencies in technical data,"Acquisition Policy, Acquisition Management, and Related Matters",1400,Fully Human Written,Human,0.0000,0.0000,1.0000,4,0,0,4,medium
812,Modifications to current defense acquisition requirements,"Acquisition Policy, Acquisition Management, and Related Matters",726,Fully Human Written,Human,0.0000,0.0000,1.0000,3,0,0,3,medium
8202,PROTECT Our Children Act of 2008 reauthorization,Judiciary Matters,1922,Fully Human Written,Human,0.0000,0.0000,1.0000,7,0,0,7,high
8203,Trauma kit standards,Judiciary Matters,467,Fully Human Written,Human,0.0000,0.0000,1.0000,2,0,0,2,low
8205,Honoring our fallen heroes,Judiciary Matters,1454,Fully Human Written,Human,0.0000,0.0000,1.0000,5,0,0,5,medium
823,Hiring authorities for Defense Civilian Training Corps,"Acquisition Policy, Acquisition Management, and Related Matters",622,Fully Human Written,Human,0.0000,0.0000,1.0000,2,0,0,2,low
824,Increasing competition in defense contracting,"Acquisition Policy, Acquisition Management, and Related Matters",628,Fully Human Written,Human,0.0000,0.0000,1.0000,2,0,0,2,low
825,Report on strengthening the Defense Acquisition University,"Acquisition Policy, Acquisition Management, and Related Matters",570,Fully Human Written,Human,0.0000,0.0000,1.0000,2,0,0,2,low
826,Restructuring of performance evaluation metrics for the acquisition workforce,"Acquisition Policy, Acquisition Management, and Related Matters",600,Fully Human Written,Human,0.0000,0.0000,1.0000,2,0,0,2,low
8302,Findings,Foreign Affairs Matters,995,Fully Human Written,Human,0.0000,0.0000,1.0000,3,0,0,3,medium
8304,Support for Taiwan admission to the IMF,Foreign Affairs Matters,283,Fully Human Written,Human,0.0000,0.0000,1.0000,1,0,0,1,low
8313,Study and report on efforts to address fentanyl trafficking from the people’s republic of china and other relevant countries,Foreign Affairs Matters,724,Fully Human Written,Human,0.0000,0.0000,1.0000,2,0,0,2,low
8317,Imposition of sanctions with respect to agencies or instrumentalities of foreign states,Foreign Affairs Matters,237,Fully Human Written,Human,0.0000,0.0000,1.0000,1,0,0,1,low
8319,Responding to crime and corruption in Haiti,Foreign Affairs Matters,1602,Fully Human Written,Human,0.0000,0.0000,1.0000,5,0,0,5,medium
832,Enhancement of defense supply chain resilience and secondary source qualification,"Acquisition Policy, Acquisition Management, and Related Matters",643,Fully Human Written,Human,0.0000,0.0000,1.0000,2,0,0,2,low
8332,Findings,Foreign Affairs Matters,737,Fully Human Written,Human,0.0000,0.0000,1.0000,2,0,0,2,low
8333,Sense of Congress,Foreign Affairs Matters,687,Fully Human Written,Human,0.0000,0.0000,1.0000,2,0,0,2,low
8335,Sanctions relating to the Western Balkans,Foreign Affairs Matters,1338,Fully Human Written,Human,0.0000,0.0000,1.0000,4,0,0,4,medium
8336,Democratic and economic development and prosperity initiatives,Foreign Affairs Matters,1645,Fully Human Written,Human,0.0000,0.0000,1.0000,5,0,0,5,medium
8338,Young Balkan Leaders Initiative,Foreign Affairs Matters,409,Fully Human Written,Human,0.0000,0.0000,1.0000,2,0,0,2,low
8339,Supporting cybersecurity and cyber resilience in the Western Balkans,Foreign Affairs Matters,471,Fully Human Written,Human,0.0000,0.0000,1.0000,2,0,0,2,low
833,Interim national security waivers for supply chain illumination efforts,"Acquisition Policy, Acquisition Management, and Related Matters",881,Fully Human Written,Human,0.0000,0.0000,1.0000,3,0,0,3,medium
8340,Relations between Kosovo and Serbia,Foreign Affairs Matters,233,Fully Human Written,Human,0.0000,0.0000,1.0000,1,0,0,1,low
8341,Reports on Russian and Chinese malign influence operations and campaigns in the Western Balkans,Foreign Affairs Matters,616,Fully Human Written,Human,0.0000,0.0000,1.0000,2,0,0,2,low
834,Strategy to eliminate acquisition of optical glass from certain nations,"Acquisition Policy, Acquisition Management, and Related Matters",391,Fully Human Written,Human,0.0000,0.0000,1.0000,1,0,0,1,low
8352,Designation of a foreign country as a State Sponsor of Unlawful or Wrongful Detention,Foreign Affairs Matters,1477,Fully Human Written,Human,0.0000,0.0000,1.0000,5,0,0,5,medium
835,Strategy to eliminate sourcing of computer displays from certain nations,"Acquisition Policy, Acquisition Management, and Related Matters",396,Fully Human Written,Human,0.0000,0.0000,1.0000,2,0,0,2,low
8361,National registry of Korean American divided families,Foreign Affairs Matters,549,Fully Human Written,Human,0.0000,0.0000,1.0000,2,0,0,2,low
8363,Supporting the identification and recovery of abducted Ukrainian children,Foreign Affairs Matters,911,Fully Human Written,Human,0.0000,0.0000,1.0000,3,0,0,3,medium
8365,Strategy for countering transnational criminal organizations in Mexico,Foreign Affairs Matters,516,Fully Human Written,Human,0.0000,0.0000,1.0000,2,0,0,2,low
8366,International nuclear energy,Foreign Affairs Matters,5452,Fully Human Written,Human,0.0000,0.0000,1.0000,16,0,0,16,high
8367,Strategy to respond to global bases of the People’s Republic of China,Foreign Affairs Matters,715,Fully Human Written,Human,0.0000,0.0000,1.0000,2,0,0,2,low
8368,Disposition of weapons and materiel in transit from Iran to the Houthis in Yemen,Foreign Affairs Matters,305,Fully Human Written,Human,0.0000,0.0000,1.0000,1,0,0,1,low
8369,Repeal of Caesar Syria Civilian Protection Act of 2019,Foreign Affairs Matters,513,Fully Human Written,Human,0.0000,0.0000,1.0000,2,0,0,2,low
836,Voluntary registration of compliance with covered sourcing requirements for covered products,"Acquisition Policy, Acquisition Management, and Related Matters",986,Fully Human Written,Human,0.0000,0.0000,1.0000,3,0,0,3,medium
837,Acceleration of qualification of compliant sources,"Acquisition Policy, Acquisition Management, and Related Matters",581,Fully Human Written,Human,0.0000,0.0000,1.0000,2,0,0,2,low
838,Assessment of critical infrastructure owned by the Department of Defense dependent on foreign materials or components,"Acquisition Policy, Acquisition Management, and Related Matters",615,Fully Human Written,Human,0.0000,0.0000,1.0000,2,0,0,2,low
8402,National Oceanic and Atmospheric Administration vessel fleet,National Oceanic and Atmospheric Administration,988,Fully Human Written,Human,0.0000,0.0000,1.0000,4,0,0,4,medium
8404,Eligibility of former officers to compete for certain positions,National Oceanic and Atmospheric Administration,482,Fully Human Written,Human,0.0000,0.0000,1.0000,2,0,0,2,low
841,Requirements relating to long-term concessions agreements with certain retailers,"Acquisition Policy, Acquisition Management, and Related Matters",963,Fully Human Written,Human,0.0000,0.0000,1.0000,3,0,0,3,medium
842,Prohibition on acquisition of advanced batteries from certain foreign sources,"Acquisition Policy, Acquisition Management, and Related Matters",859,Fully Human Written,Human,0.0000,0.0000,1.0000,3,0,0,3,medium
847,Prohibiting the purchase of photovoltaic modules or inverters from foreign entities of concern,"Acquisition Policy, Acquisition Management, and Related Matters",323,,Human,0.0000,0.0000,1.0000,1,0,0,1,low
849,Prohibition on procurement related to certain additive manufacturing machines,"Acquisition Policy, Acquisition Management, and Related Matters",308,,Human,0.0000,0.0000,1.0000,1,0,0,1,low
850,Phase-out of computer and printer acquisitions involving entities owned or controlled by China,"Acquisition Policy, Acquisition Management, and Related Matters",785,Fully Human Written,Human,0.0000,0.0000,1.0000,3,0,0,3,medium
8511,Imposition of sanctions,Comprehensive Outbound Investment National Security Act of 2025,426,Fully Human Written,Human,0.0000,0.0000,1.0000,2,0,0,2,low
851,Prohibition on contracting with certain biotechnology providers,"Acquisition Policy, Acquisition Management, and Related Matters",2866,Fully Human Written,Human,0.0000,0.0000,1.0000,9,0,0,9,high
8521,Prohibition and notification on investments relating to covered national security transactions,Comprehensive Outbound Investment National Security Act of 2025,5233,Fully Human Written,Human,0.0000,0.0000,1.0000,15,0,0,15,high
8531,Requirements relating to the Non-SDN Chinese Military-Industrial Complex Companies List,Comprehensive Outbound Investment National Security Act of 2025,646,Fully Human Written,Human,0.0000,0.0000,1.0000,2,0,0,2,low
8602,Drone countermeasures to protect public safety and critical infrastructure,"Securing the Airspace, Facilitating Emergency Response, and Safeguarding Key Infrastructure, Entertainment Venues, and Stadiums",1811,Fully Human Written,Human,0.0000,0.0000,1.0000,6,0,0,6,high
8605,Penalties,"Securing the Airspace, Facilitating Emergency Response, and Safeguarding Key Infrastructure, Entertainment Venues, and Stadiums",508,Fully Human Written,Human,0.0000,0.0000,1.0000,2,0,0,2,low
8606,Rulemaking and implementation,"Securing the Airspace, Facilitating Emergency Response, and Safeguarding Key Infrastructure, Entertainment Venues, and Stadiums",452,Fully Human Written,Human,0.0000,0.0000,1.0000,2,0,0,2,low
8617A,United States Navy Museum System,Operation and Maintenance,384,"Mostly Human, AI Detected",Mixed,0.1071,0.0000,0.8929,2,1,0,1,low
863,Special Operations Command Urgent Innovative Technologies and Capabilities Initiative,"Acquisition Policy, Acquisition Management, and Related Matters",346,,Human,0.0000,0.0000,1.0000,1,0,0,1,low
864,United States-Israel Defense Industrial Base Working Group,"Acquisition Policy, Acquisition Management, and Related Matters",350,,Human,0.0000,0.0000,1.0000,0,0,0,0,low
865,Improving the domestic textile and industrial base,"Acquisition Policy, Acquisition Management, and Related Matters",1739,Fully Human Written,Human,0.0000,0.0000,1.0000,5,0,0,5,medium
866,Cybersecurity regulatory harmonization,"Acquisition Policy, Acquisition Management, and Related Matters",465,Fully Human Written,Human,0.0000,0.0000,1.0000,2,0,0,2,low
867,Modifications to defense industrial base fund,"Acquisition Policy, Acquisition Management, and Related Matters",2471,Fully Human Written,Human,0.0000,0.0000,1.0000,8,0,0,8,high
8698,Roles and responsibilities relating to sustainment and readiness of certain naval surface vessels,Operation and Maintenance,460,Fully Human Written,Human,0.0000,0.0000,1.0000,2,0,0,2,low
8712,Less developed country focus,DFC Modernization and Reauthorization Act of 2025,919,Fully Human Written,Human,0.0000,0.0000,1.0000,3,0,0,3,medium
8729,Strategic Advisory Group,DFC Modernization and Reauthorization Act of 2025,782,Fully Human Written,Human,0.0000,0.0000,1.0000,3,0,0,3,medium
8730,Five-year strategic priorities plan,DFC Modernization and Reauthorization Act of 2025,419,Fully Human Written,Human,0.0000,0.0000,1.0000,2,0,0,2,low
8731,Development finance education,DFC Modernization and Reauthorization Act of 2025,318,Fully Human Written,Human,0.0000,0.0000,1.0000,1,0,0,1,low
8732,Internships,DFC Modernization and Reauthorization Act of 2025,590,Fully Human Written,Human,0.0000,0.0000,1.0000,2,0,0,2,low
873,Combatant command experimentation authority,"Acquisition Policy, Acquisition Management, and Related Matters",322,,Human,0.0000,0.0000,1.0000,1,0,0,1,low
874,Annual report on contract cancellations and terminations,"Acquisition Policy, Acquisition Management, and Related Matters",315,,Human,0.0000,0.0000,1.0000,0,0,0,0,low
8743,Terms and conditions,DFC Modernization and Reauthorization Act of 2025,526,Fully Human Written,Human,0.0000,0.0000,1.0000,2,0,0,2,low
875,Ability to withhold contract payments during period of pendancy of a bid protest,"Acquisition Policy, Acquisition Management, and Related Matters",441,Fully Human Written,Human,0.0000,0.0000,1.0000,2,0,0,2,low
8801,Pilot program for sound insulation repair and replacement,Other Matters,785,Fully Human Written,Human,0.0000,0.0000,1.0000,3,0,0,3,medium
8803,Lumbee Fairness Act,Other Matters,1339,Fully Human Written,Human,0.0000,0.0000,1.0000,4,0,0,4,medium
906,Additional authorities for Office of Strategic Capital,Department of Defense Organization and Management,999,Fully Human Written,Human,0.0000,0.0000,1.0000,3,0,0,3,medium
907,Defense Science Board study on optimal organizational structure for digital solution and software delivery,Department of Defense Organization and Management,510,"Mostly Human, AI Detected",Mixed,0.2680,0.0000,0.7320,2,1,0,1,low
912,Joint Interagency Task Force 401,Department of Defense Organization and Management,1424,Fully Human Written,Human,0.0000,0.0000,1.0000,5,0,0,5,medium
