section_number,title,division,word_count,headline,prediction_short,fraction_ai,fraction_ai_assisted,fraction_human,total_segments,num_ai_segments,num_ai_assisted_segments,num_human_segments,reliability
5175,Establishing and expanding the Regional China Officer program,Organization and operations,626,Fully Human Written,Human,0.0000,0.0000,1.0000,2,0,0,2,low
517,Notice of impact of diplomatic and consular post closings on intelligence community,Intelligence Community Matters,320,,Human,0.0000,0.0000,1.0000,1,0,0,1,low
6309,Plan for implementing an integrated system spanning the intelligence community for accreditation of sensitive compartmented information facilities,Intelligence Community Matters,260,,Human,0.0000,0.0000,1.0000,1,0,0,1,low
6310,Reforms relating to inactive security clearances,Intelligence Community Matters,329,,Human,0.0000,0.0000,1.0000,1,0,0,1,low
518,Notice of counterintelligence assessments and investigations of Federal candidates or officeholders,Matters Relating to Elements of the Intelligence Community,302,,Human,0.0000,0.0000,1.0000,1,0,0,1,low
6521,Notice of counterintelligence assessments and investigations by the Federal Bureau of Investigation of candidates for or holders of Federal office,Matters Relating to Elements of the Intelligence Community,360,,Human,0.0000,0.0000,1.0000,1,0,0,1,low
6522,Notification of material changes to policies or procedures governing terrorist watchlist and transnational organized crime watchlist,Matters Relating to Elements of the Intelligence Community,306,,Human,0.0000,0.0000,1.0000,1,0,0,1,low
6524,Annual report on Federal Bureau of Investigation case data,Matters Relating to Elements of the Intelligence Community,249,,Human,0.0000,0.0000,1.0000,1,0,0,1,low
521,Individual Longitudinal Exposure Record: codification; expansion,Military Personnel Policy,435,Fully Human Written,Human,0.0000,0.0000,1.0000,2,0,0,2,low
522,Women’s initiative teams,Military Personnel Policy,350,,AI,0.5000,0.0000,0.5000,2,1,0,1,low
996,Individual Longitudinal Exposure Record,Military Personnel Policy,370,,Human,0.0000,0.0000,1.0000,1,0,0,1,low
526,Report on adequacy of reimbursement for costs of permanent change of station,Military Personnel Policy,939,AI Detected,Mixed,0.7085,0.0000,0.2915,3,2,0,1,medium
5301,Post Data Pilot Program,Information security and cyber diplomacy,260,,Human,0.0000,0.0000,1.0000,1,0,0,1,low
5304,Commercial spyware,Information security and cyber diplomacy,332,,Human,0.0000,0.0000,1.0000,1,0,0,1,low
5303,Reports on technology transformation projects at the Department,Information security and cyber diplomacy,747,Fully AI Generated,AI,1.0000,0.0000,0.0000,3,3,0,0,medium
532,Alternative service in areas of national interest by individuals denied enlistment,Military Personnel Policy,334,,Human,0.0000,0.0000,1.0000,1,0,0,1,low
658,Medical accession standards for members of the armed forces,Military Personnel Policy,349,,Human,0.0000,0.0000,1.0000,1,0,0,1,low
533,Medical accession standards for members of the Armed Forces,Military Personnel Policy,379,Fully Human Written,Human,0.0000,0.0000,1.0000,1,0,0,1,low
5404,Foreign information manipulation and interference strategy,Public diplomacy,455,Fully Human Written,Human,0.0000,0.0000,1.0000,2,0,0,2,low
545,Mandatory training on government ethics and national security law,Military Personnel Policy,271,,Human,0.0000,0.0000,1.0000,1,0,0,1,low
549,Accreditation of National Guard Marksmanship Training Center,Military Personnel Policy,240,,Human,0.0000,0.0000,1.0000,1,0,0,1,low
548,Limitation on authority to reorganize the Senior Reserve Officers' Training Corps of the Army,Military Personnel Policy,451,Fully Human Written,Human,0.0000,0.0000,1.0000,2,0,0,2,low
5506,"Report on security conditions in Damascus, Syria, required for the reopening of the United States diplomatic mission",Diplomatic security,381,Fully Human Written,Human,0.0000,0.0000,1.0000,1,0,0,1,low
5606,Report on United States Mission Australia staffing,Miscellaneous,415,Fully Human Written,Human,0.0000,0.0000,1.0000,2,0,0,2,low
571,Transition Assistance Program: amendments; pilot program; reports,Military Personnel Policy,971,Fully Human Written,Human,0.0000,0.0000,1.0000,3,0,0,3,medium
584,Authorization of dual or concurrent enrollment programs for students of Defense Dependent Schools,Military Personnel Policy,991,Fully Human Written,Human,0.0000,0.0000,1.0000,3,0,0,3,medium
589A,Verification of reporting of eligible federally connected children for purposes of Federal impact aid programs,Military Personnel Policy,329,,Human,0.0000,0.0000,1.0000,1,0,0,1,low
589,Certain assistance to local educational agencies that benefit dependents of military and civilian personnel,Military Personnel Policy,372,,Human,0.0000,0.0000,1.0000,2,0,0,2,low
589D,Pilot program to increase payments for child care services in high-cost areas,Military Personnel Policy,496,Fully Human Written,Human,0.0000,0.0000,1.0000,2,0,0,2,low
589V,Management of special education in schools operated by Department of Defense Education Activity,Military Personnel Policy,874,Fully Human Written,Human,0.0000,0.0000,1.0000,3,0,0,3,medium
5,Eligibility for Federal services,Other Matters,383,Fully Human Written,Human,0.0000,0.0000,1.0000,1,0,0,1,low
6104,"Monitoring of industrial base for nuclear weapons components, subsystems, and materials",Department of Energy National Security Programs,475,Fully Human Written,Human,0.0000,0.0000,1.0000,2,0,0,2,low
6105,Common financial reporting system for the nuclear security enterprise,Department of Energy National Security Programs,390,Fully Human Written,Human,0.0000,0.0000,1.0000,1,0,0,1,low
6114,"Nuclear weapons stockpile stewardship, management, and responsiveness plan",Department of Energy National Security Programs,2549,Fully Human Written,Human,0.0000,0.0000,1.0000,8,0,0,8,high
6117,Annual assessments and reports to the President and Congress regarding the condition of the United States nuclear weapons stockpile,Department of Energy National Security Programs,1149,Fully Human Written,Human,0.0000,0.0000,1.0000,4,0,0,4,medium
6119,Nuclear test ban readiness program,Department of Energy National Security Programs,296,,Human,0.0000,0.0000,1.0000,1,0,0,1,low
6122,Manufacturing infrastructure for refabrication and certification of nuclear weapons stockpile,Department of Energy National Security Programs,243,,Human,0.0000,0.0000,1.0000,1,0,0,1,low
6129,Certification of completion of milestones with respect to plutonium pit aging,Department of Energy National Security Programs,282,,Human,0.0000,0.0000,1.0000,1,0,0,1,low
6133,Plan for domestic enrichment capability to satisfy Department of Defense uranium requirements,Department of Energy National Security Programs,365,,Human,0.0000,0.0000,1.0000,1,0,0,1,low
6134,Incorporation of integrated surety architecture,Department of Energy National Security Programs,244,,Human,0.0000,0.0000,1.0000,1,0,0,1,low
6180,Policy of Department of Energy regarding future defense environmental management matters,Department of Energy National Security Programs,317,,Human,0.0000,0.0000,1.0000,0,0,0,0,low
6201,Safety measures for waste tanks at Hanford Nuclear Reservation,Department of Energy National Security Programs,228,,Human,0.0000,0.0000,1.0000,0,0,0,0,low
6120,Requirements for specific request for new or modified nuclear weapons,Department of Energy National Security Programs,565,Fully Human Written,Human,0.0000,0.0000,1.0000,2,0,0,2,low
6125,Selected acquisition reports and independent cost estimates and reviews of certain programs and facilities,Department of Energy National Security Programs,652,Fully Human Written,Human,0.0000,0.0000,1.0000,2,0,0,2,low
6126,"Advice to President and Congress regarding safety, security, and reliability of United States nuclear weapons stockpile",Department of Energy National Security Programs,480,Fully Human Written,Human,0.0000,0.0000,1.0000,2,0,0,2,low
6128,Plutonium pit production capacity,Department of Energy National Security Programs,962,Fully Human Written,Human,0.0000,0.0000,1.0000,3,0,0,3,medium
6131,Stockpile responsiveness program,Department of Energy National Security Programs,395,Fully Human Written,Human,0.0000,0.0000,1.0000,2,0,0,2,low
6132,Long-term plan for meeting national security requirements for unencumbered uranium,Department of Energy National Security Programs,511,Fully Human Written,Human,0.0000,0.0000,1.0000,2,0,0,2,low
6135,W93 nuclear warhead acquisition process,Department of Energy National Security Programs,546,Fully Human Written,Human,0.0000,0.0000,1.0000,2,0,0,2,low
614,Reviews of designations of imminent danger pay areas,Compensation and Other Personnel Benefits,294,Fully Human Written,Human,0.0000,0.0000,1.0000,1,0,0,1,low
6153,Disposition of weapons-usable plutonium at Savannah River Site,Department of Energy National Security Programs,1585,Fully Human Written,Human,0.0000,0.0000,1.0000,5,0,0,5,medium
6154,"Disposition of surplus defense plutonium at Savannah River Site, Aiken, South Carolina",Department of Energy National Security Programs,607,Fully Human Written,Human,0.0000,0.0000,1.0000,2,0,0,2,low
6155,"Acceleration of removal or security of fissile materials, radiological materials, and related equipment at vulnerable sites worldwide",Department of Energy National Security Programs,1268,Fully Human Written,Human,0.0000,0.0000,1.0000,4,0,0,4,medium
6156,Acceleration of replacement of cesium blood irradiation sources,Department of Energy National Security Programs,539,Fully Human Written,Human,0.0000,0.0000,1.0000,2,0,0,2,low
6159,Defense nuclear nonproliferation management plan,Department of Energy National Security Programs,1025,Fully Human Written,Human,0.0000,0.0000,1.0000,3,0,0,3,medium
6173,Requirement to develop future use plans for defense environmental cleanup,Department of Energy National Security Programs,472,Fully Human Written,Human,0.0000,0.0000,1.0000,2,0,0,2,low
6174,Future-years defense environmental cleanup plan,Department of Energy National Security Programs,412,Fully Human Written,Human,0.0000,0.0000,1.0000,2,0,0,2,low
6177,Other programs relating to technology development,Department of Energy National Security Programs,1567,Fully Human Written,Human,0.0000,0.0000,1.0000,5,0,0,5,medium
6192,Defense site acceleration completion,Department of Energy National Security Programs,923,Fully Human Written,Human,0.0000,0.0000,1.0000,3,0,0,3,medium
6194,Plan for deactivation and decommissioning of nonoperational defense nuclear facilities,Department of Energy National Security Programs,587,Fully Human Written,Human,0.0000,0.0000,1.0000,2,0,0,2,low
6202,Hanford waste tank cleanup program reforms,Department of Energy National Security Programs,323,,Human,0.0000,0.0000,1.0000,1,0,0,1,low
6224,Department of Energy counterintelligence polygraph program,Department of Energy National Security Programs,257,,Human,0.0000,0.0000,1.0000,1,0,0,1,low
6253,Fellowship program for development of skills critical to the nuclear security enterprise,Department of Energy National Security Programs,364,,Human,0.0000,0.0000,1.0000,1,0,0,1,low
6262,Safety oversight and enforcement at defense nuclear facilities,Department of Energy National Security Programs,268,,Human,0.0000,0.0000,1.0000,1,0,0,1,low
6266,Notification of nuclear criticality and non-nuclear incidents,Department of Energy National Security Programs,361,,Human,0.0000,0.0000,1.0000,1,0,0,1,low
6272,Reprogramming,Department of Energy National Security Programs,299,,Human,0.0000,0.0000,1.0000,0,0,0,0,low
621,Modifications to calculation of basic allowance for subsistence for enlisted members,Compensation and Other Personnel Benefits,408,Fully Human Written,Human,0.0000,0.0000,1.0000,2,0,0,2,low
6222,Restrictions on access to national security laboratories by foreign visitors from sensitive countries,Department of Energy National Security Programs,712,Fully Human Written,Human,0.0000,0.0000,1.0000,2,0,0,2,low
6225,Notice to congressional committees of certain security and counterintelligence failures within atomic energy defense programs,Department of Energy National Security Programs,406,Fully Human Written,Human,0.0000,0.0000,1.0000,1,0,0,1,low
6226,Annual report and certification on status of security of atomic energy defense facilities,Department of Energy National Security Programs,378,Fully Human Written,Human,0.0000,0.0000,1.0000,1,0,0,1,low
6227,Protection of certain nuclear facilities and assets from unmanned aircraft,Department of Energy National Security Programs,422,Fully Human Written,Human,0.0000,0.0000,1.0000,2,0,0,2,low
6228,Reporting on penetrations of networks of contractors and subcontractors,Department of Energy National Security Programs,877,Fully Human Written,Human,0.0000,0.0000,1.0000,3,0,0,3,medium
6232,Protection against inadvertent release of restricted data and formerly restricted data,Department of Energy National Security Programs,651,Fully Human Written,Human,0.0000,0.0000,1.0000,2,0,0,2,low
6241,"Authority for appointment of certain scientific, engineering, and technical personnel",Department of Energy National Security Programs,417,Fully Human Written,Human,0.0000,0.0000,1.0000,2,0,0,2,low
6242,Whistleblower protection program,Department of Energy National Security Programs,966,Fully Human Written,Human,0.0000,0.0000,1.0000,3,0,0,3,medium
6243,Department of Energy defense nuclear facilities workforce restructuring plan,Department of Energy National Security Programs,935,Fully Human Written,Human,0.0000,0.0000,1.0000,3,0,0,3,medium
624,Improvements to basic allowance for housing,Compensation and Other Personnel Benefits,781,Fully Human Written,Human,0.0000,0.0000,1.0000,3,0,0,3,medium
6261,Worker protection at nuclear weapons facilities,Department of Energy National Security Programs,382,Fully Human Written,Human,0.0000,0.0000,1.0000,2,0,0,2,low
6263,Program to monitor department of energy workers exposed to hazardous and radioactive substances,Department of Energy National Security Programs,646,Fully Human Written,Human,0.0000,0.0000,1.0000,2,0,0,2,low
6264,Programs for persons who may have been exposed to radiation released from Hanford Nuclear Reservation,Department of Energy National Security Programs,656,Fully Human Written,Human,0.0000,0.0000,1.0000,2,0,0,2,low
6273,Minor construction projects,Department of Energy National Security Programs,289,,Human,0.0000,0.0000,1.0000,1,0,0,1,low
6275,Limits on construction projects,Department of Energy National Security Programs,241,,Human,0.0000,0.0000,1.0000,1,0,0,1,low
6276,Fund transfer authority,Department of Energy National Security Programs,284,,Human,0.0000,0.0000,1.0000,0,0,0,0,low
6277,Conceptual and construction design,Department of Energy National Security Programs,230,,Human,0.0000,0.0000,1.0000,0,0,0,0,low
6281,Transfer of defense environmental cleanup funds,Department of Energy National Security Programs,353,,Human,0.0000,0.0000,1.0000,1,0,0,1,low
6282,Transfer of weapons activities funds,Department of Energy National Security Programs,362,,Human,0.0000,0.0000,1.0000,1,0,0,1,low
6284,Notification of cost overruns for certain Department of Energy projects,Department of Energy National Security Programs,975,Fully Human Written,Human,0.0000,0.0000,1.0000,3,0,0,3,medium
6286,Use of best practices for capital asset projects and nuclear weapon life extension programs,Department of Energy National Security Programs,262,,Human,0.0000,0.0000,1.0000,1,0,0,1,low
6288,Unfunded priorities of the Administration,Department of Energy National Security Programs,333,,Human,0.0000,0.0000,1.0000,1,0,0,1,low
6289,Review of adequacy of nuclear weapons budget,Department of Energy National Security Programs,316,,Human,0.0000,0.0000,1.0000,1,0,0,1,low
6312,Independent acquisition project reviews of capital assets acquisition projects,Department of Energy National Security Programs,301,,Human,0.0000,0.0000,1.0000,1,0,0,1,low
6325,Notice-and-wait requirement applicable to certain third-party financing arrangements,Department of Energy National Security Programs,232,,Human,0.0000,0.0000,1.0000,0,0,0,0,low
6336,Report on use of funds for certain research and development purposes,Department of Energy National Security Programs,263,,Human,0.0000,0.0000,1.0000,0,0,0,0,low
6305,Annual survey of analytic objectivity among officers and employees of elements of the intelligence community,Intelligence Community Matters,383,Fully Human Written,Human,0.0000,0.0000,1.0000,2,0,0,2,low
6311,Reports on financial balances for atomic energy defense activities,Department of Energy National Security Programs,643,Fully Human Written,Human,0.0000,0.0000,1.0000,2,0,0,2,low
6321,Costs not allowed under covered contracts,Department of Energy National Security Programs,487,Fully Human Written,Human,0.0000,0.0000,1.0000,2,0,0,2,low
6324,Contractor liability for injury or loss of property arising out of atomic weapons testing programs,Department of Energy National Security Programs,618,Fully Human Written,Human,0.0000,0.0000,1.0000,2,0,0,2,low
6327,Enhanced procurement authority to manage supply chain risk,Department of Energy National Security Programs,1024,Fully Human Written,Human,0.0000,0.0000,1.0000,3,0,0,3,medium
6328,Cost-benefit analyses for competition of management and operating contracts,Department of Energy National Security Programs,799,Fully Human Written,Human,0.0000,0.0000,1.0000,2,0,0,2,low
6337,Critical technology partnerships and cooperative research and development centers,Department of Energy National Security Programs,413,Fully Human Written,Human,0.0000,0.0000,1.0000,2,0,0,2,low
6351,Transfers of real property at certain Department of Energy facilities,Department of Energy National Security Programs,719,Fully Human Written,Human,0.0000,0.0000,1.0000,2,0,0,2,low
6354,Pilot program relating to use of proceeds of disposal or utilization of certain department of energy assets,Department of Energy National Security Programs,387,Fully Human Written,Human,0.0000,0.0000,1.0000,1,0,0,1,low
6355,Department of Energy energy parks program,Department of Energy National Security Programs,323,,Human,0.0000,0.0000,1.0000,1,0,0,1,low
6362,University-based defense nuclear policy collaboration program,Department of Energy National Security Programs,248,,Human,0.0000,0.0000,1.0000,1,0,0,1,low
6356,Authority to use passenger carriers for contractor commuting,Department of Energy National Security Programs,546,Fully Human Written,Human,0.0000,0.0000,1.0000,2,0,0,2,low
6404,National Counterproliferation and Biosecurity Center,Intelligence Community Efficiency and Effectiveness,706,Fully Human Written,Human,0.0000,0.0000,1.0000,3,0,0,3,medium
6502,Improvements to security of Central Intelligence Agency installations,Matters Relating to Elements of the Intelligence Community,3052,Fully Human Written,Human,0.0000,0.0000,1.0000,9,0,0,9,high
6511,Counterintelligence briefings for members of the Armed Forces,Matters Relating to Elements of the Intelligence Community,275,Fully Human Written,Human,0.0000,0.0000,1.0000,1,0,0,1,low
6523,Annual report on United States persons on the terrorist watch list,Matters Relating to Elements of the Intelligence Community,421,Fully Human Written,Human,0.0000,0.0000,1.0000,2,0,0,2,low
6604,Prohibition on use of DeepSeek on intelligence community systems,Artificial Intelligence and Other Emerging Technologies,241,Fully Human Written,Human,0.0000,0.0000,1.0000,1,0,0,1,low
6612,Plan on enhanced intelligence sharing relating to foreign adversary biotechnological threats,Artificial Intelligence and Other Emerging Technologies,285,,Human,0.0000,0.0000,1.0000,1,0,0,1,low
6613,Enhancing biotechnology talent within the intelligence community,Artificial Intelligence and Other Emerging Technologies,324,,Human,0.0000,0.0000,1.0000,1,0,0,1,low
6614,Enhanced intelligence community support to secure United States biological data,Artificial Intelligence and Other Emerging Technologies,433,Fully Human Written,Human,0.0000,0.0000,1.0000,2,0,0,2,low
6615,Ensuring intelligence community procurement of domestic United States production of synthetic DNA and RNA,Artificial Intelligence and Other Emerging Technologies,427,Fully Human Written,Human,0.0000,0.0000,1.0000,2,0,0,2,low
6621,Enhancing intelligence community technology adoption metrics,Artificial Intelligence and Other Emerging Technologies,254,,Human,0.0000,0.0000,1.0000,1,0,0,1,low
6622,Report on identification of intelligence community sites for advanced nuclear technologies,Artificial Intelligence and Other Emerging Technologies,356,,Human,0.0000,0.0000,1.0000,1,0,0,1,low
662,Provision of information regarding relocation assistance programs for members receiving orders for a change of permanent station,Compensation and Other Personnel Benefits,592,Fully AI Generated,AI,1.0000,0.0000,0.0000,2,2,0,0,low
664,Military compensation educational campaign,Compensation and Other Personnel Benefits,301,,Human,0.0000,0.0000,1.0000,1,0,0,1,low
665,Designation of United States Army Garrison Kwajalein Atoll as remote and isolated military installation,Compensation and Other Personnel Benefits,225,,Human,0.0000,0.0000,1.0000,1,0,0,1,low
6703,"Prohibition on intelligence community contracting with Chinese military companies engaged in biotechnology research, development, or manufacturing",Matters Relating to Foreign Countries,778,AI Detected,Mixed,0.4872,0.0000,0.5128,3,1,0,2,medium
6704,Report on the wealth of the leadership of the Chinese Communist Party,Matters Relating to Foreign Countries,364,,Human,0.0000,0.0000,1.0000,1,0,0,1,low
6705,Assessment and report on investments by the People’s Republic of China in the agriculture sector of Brazil,Matters Relating to Foreign Countries,361,,Human,0.0000,0.0000,1.0000,0,0,0,0,low
6706,Identification of entities that provide support to the People’s Liberation Army,Matters Relating to Foreign Countries,233,,Human,0.0000,0.0000,1.0000,0,0,0,0,low
6716,National Intelligence Estimate on the Western Hemisphere,Matters Relating to Foreign Countries,256,,Human,0.0000,0.0000,1.0000,1,0,0,1,low
6718,Requirements with respect to duty to warn former senior officials and other United States persons,Matters Relating to Foreign Countries,375,,Human,0.0000,0.0000,1.0000,1,0,0,1,low
6803,Declassification of intelligence and additional transparency measures relating to the COVID–19 pandemic,Reports and Other Matters,466,Fully Human Written,Human,0.0000,0.0000,1.0000,2,0,0,2,low
6804,Classified intelligence budget justification materials and submission of intelligence community drug control resource summary,Reports and Other Matters,514,Fully Human Written,Human,0.0000,0.0000,1.0000,2,0,0,2,low
7111,Annual report on progress of certain homeporting projects,Coast Guard,673,Fully Human Written,Human,0.0000,0.0000,1.0000,2,0,0,2,low
7113,Quarterly acquisition brief requirements,Coast Guard,661,Fully Human Written,Human,0.0000,0.0000,1.0000,2,0,0,2,low
7115,Requirement for Coast Guard to provide analysis of alternatives for aircraft,Coast Guard,357,Fully Human Written,Human,0.0000,0.0000,1.0000,1,0,0,1,low
7117,Regular polar security cutter updates,Coast Guard,460,Fully Human Written,Human,0.0000,0.0000,1.0000,2,0,0,2,low
7118,Annual plan for Coast Guard operations in the Pacific; feasibility study on supporting additional port visits and deployments in support of operation blue pacific,Coast Guard,917,Fully Human Written,Human,0.0000,0.0000,1.0000,3,0,0,3,medium
7119,Annual plan for Coast Guard operations in the Caribbean,Coast Guard,692,Fully Human Written,Human,0.0000,0.0000,1.0000,2,0,0,2,low
712,Military-civilian medical surge program,Health Care Provisions,898,Fully Human Written,Human,0.0000,0.0000,1.0000,3,0,0,3,medium
715,Military medical cooperation arrangements among Five Eyes countries,Health Care Provisions,355,,Human,0.0000,0.0000,1.0000,2,0,0,2,low
720,Review of disclosure requirements under processes and forms relating to health care provider credentialing and privileging of Department of Defense,Health Care Provisions,345,,Human,0.0000,0.0000,1.0000,1,0,0,1,low
717,Plan for priority assignment of medical personnel of Department of Defense,Health Care Provisions,771,Fully Human Written,Human,0.0000,0.0000,1.0000,2,0,0,2,low
719,Strategic infectious disease medical research plan,Health Care Provisions,826,Fully Human Written,Human,0.0000,0.0000,1.0000,3,0,0,3,medium
7201,Reorganization of chapter 3,"Organization, Authorities, Acquisition, and Personnel of the Coast Guard",4426,Fully Human Written,Human,0.0000,0.0000,1.0000,15,0,0,15,high
7205,Preparedness plans for Coast Guard properties located in tsunami inundation zones,"Organization, Authorities, Acquisition, and Personnel of the Coast Guard",556,Fully Human Written,Human,0.0000,0.0000,1.0000,2,0,0,2,low
7207,Coast Guard access to Department of the Treasury fund,"Organization, Authorities, Acquisition, and Personnel of the Coast Guard",533,Fully Human Written,Human,0.0000,0.0000,1.0000,3,0,0,3,medium
7215,Great Lakes icebreaking,"Organization, Authorities, Acquisition, and Personnel of the Coast Guard",772,Fully Human Written,Human,0.0000,0.0000,1.0000,3,0,0,3,medium
7218,Procurement of tactical maritime surveillance systems,"Organization, Authorities, Acquisition, and Personnel of the Coast Guard",335,Fully Human Written,Human,0.0000,0.0000,1.0000,1,0,0,1,low
7224,Modifications and revisions relating to reopening retired grade determinations,"Organization, Authorities, Acquisition, and Personnel of the Coast Guard",551,Fully Human Written,Human,0.0000,0.0000,1.0000,2,0,0,2,low
7228,"Authority for certain personnel; command sponsorship for dependents of members of Coast Guard assigned to Unalaska, Alaska; improved prevention of and response to hazing and bullying","Organization, Authorities, Acquisition, and Personnel of the Coast Guard",1173,Fully Human Written,Human,0.0000,0.0000,1.0000,4,0,0,4,medium
