section_number,title,division,word_count,headline,prediction_short,fraction_ai,fraction_ai_assisted,fraction_human,total_segments,num_ai_segments,num_ai_assisted_segments,num_human_segments,reliability
220,Application of software innovation to modernize test and evaluation infrastructure,"Research, Development, Test, and Evaluation",547,Fully Human Written,Human,0.0000,0.0000,1.0000,2,0,0,2,low
221,"Review and alignment of standards, guidance, and policies relating to digital engineering","Research, Development, Test, and Evaluation",712,Fully Human Written,Human,0.0000,0.0000,1.0000,2,0,0,2,low
2229b,Responsibility for contested logistics posture management,Operation and Maintenance,714,Fully Human Written,Human,0.0000,0.0000,1.0000,2,0,0,2,low
224,National Security and Defense Artificial Intelligence Institute,"Research, Development, Test, and Evaluation",645,Fully Human Written,Human,0.0000,0.0000,1.0000,2,0,0,2,low
225,Advanced robotic automation for munitions manufacturing,"Research, Development, Test, and Evaluation",226,,Human,0.0000,0.0000,1.0000,1,0,0,1,low
226,Evaluation of additional test corridors for hypersonic and long-range weapons,"Research, Development, Test, and Evaluation",271,,Human,0.0000,0.0000,1.0000,1,0,0,1,low
227,Western regional range complex demonstration,"Research, Development, Test, and Evaluation",359,,Human,0.0000,0.0000,1.0000,1,0,0,1,low
229,Pilot program on modernized health and usage monitoring systems to address obsolescence in rotary-wing and tiltrotor aircraft,"Research, Development, Test, and Evaluation",241,,Human,0.0000,0.0000,1.0000,1,0,0,1,low
232,"Limitation on availability of funds for realignment of research, development, test, and evaluation functions of Joint conventional armaments and ammunition","Research, Development, Test, and Evaluation",290,,Human,0.0000,0.0000,1.0000,1,0,0,1,low
228,Demonstration of near real-time monitoring capabilities to enhance weapon system platforms,"Research, Development, Test, and Evaluation",385,Fully Human Written,Human,0.0000,0.0000,1.0000,2,0,0,2,low
2301,Authorized Air Force construction and land acquisition projects,Air Force Military Construction,339,Fully Human Written,Human,0.0000,0.0000,1.0000,2,0,0,2,low
2401,Authorized defense agencies construction and land acquisition projects,Defense Agencies Military Construction,263,,Human,0.0000,0.0000,1.0000,2,0,0,2,low
2402,Authorized energy resilience and conservation investment program projects,Defense Agencies Military Construction,243,,Human,0.0000,0.0000,1.0000,0,0,0,0,low
242,Biotechnology Management Office,"Research, Development, Test, and Evaluation",395,Fully Human Written,Human,0.0000,0.0000,1.0000,2,0,0,2,low
243,Bioindustrial commercialization program,"Research, Development, Test, and Evaluation",953,Fully Human Written,Human,0.0000,0.0000,1.0000,3,0,0,3,medium
244,Biotechnology supply chain resiliency program,"Research, Development, Test, and Evaluation",785,AI Detected,Mixed,0.7452,0.0000,0.2548,3,2,0,1,medium
245,Biological data for artificial intelligence,"Research, Development, Test, and Evaluation",330,,Human,0.0000,0.0000,1.0000,1,0,0,1,low
248,Establishing biobased product merit guidance,"Research, Development, Test, and Evaluation",261,,Human,0.0000,0.0000,1.0000,1,0,0,1,low
246,Department of Defense biotechnology strategy,"Research, Development, Test, and Evaluation",428,Fully Human Written,Human,0.0000,0.0000,1.0000,2,0,0,2,low
247,Ethical and responsible development and deployment of biotechnology within the Department of Defense,"Research, Development, Test, and Evaluation",476,Fully Human Written,Human,0.0000,0.0000,1.0000,2,0,0,2,low
2517,Authority for certain personnel,"Organization, Authorities, Acquisition, and Personnel of the Coast Guard",440,Fully Human Written,Human,0.0000,0.0000,1.0000,2,0,0,2,low
2519,Prevention of and response to hazing and bullying,"Organization, Authorities, Acquisition, and Personnel of the Coast Guard",609,Fully Human Written,Human,0.0000,0.0000,1.0000,2,0,0,2,low
2531,Comprehensive policy and procedures on retention and access to evidence and records relating to sexual misconduct and other misconduct,Sexual Assault and Sexual Harassment Response,1949,Fully Human Written,Human,0.0000,0.0000,1.0000,6,0,0,6,high
2532,Requirement to maintain certain records,Sexual Assault and Sexual Harassment Response,335,Fully Human Written,Human,0.0000,0.0000,1.0000,1,0,0,1,low
2533,Covered misconduct in Coast Guard,Sexual Assault and Sexual Harassment Response,2358,Fully Human Written,Human,0.0000,0.0000,1.0000,7,0,0,7,high
2534,Review of discharge characterization,Sexual Assault and Sexual Harassment Response,498,Fully Human Written,Human,0.0000,0.0000,1.0000,2,0,0,2,low
2535,Safe-to-Report policy for Coast Guard,Sexual Assault and Sexual Harassment Response,397,Fully Human Written,Human,0.0000,0.0000,1.0000,2,0,0,2,low
2537,Accountability and transparency relating to allegations of misconduct against senior leaders,Sexual Assault and Sexual Harassment Response,627,Fully Human Written,Human,0.0000,0.0000,1.0000,2,0,0,2,low
2538,Inclusion and command review of information on covered misconduct in personnel service records,Sexual Assault and Sexual Harassment Response,454,Fully Human Written,Human,0.0000,0.0000,1.0000,2,0,0,2,low
253,"Quarterly briefings on research, development, test, and evaluation laboratories and facilities","Research, Development, Test, and Evaluation",323,Fully Human Written,Human,0.0000,0.0000,1.0000,1,0,0,1,low
2636b,Responsibilities for oversight of personal property transportation,Operation and Maintenance,266,,Human,0.0000,0.0000,1.0000,1,0,0,1,low
341,Maintenance inspection capabilities and requirements,Operation and Maintenance,295,,Human,0.0000,0.0000,1.0000,1,0,0,1,low
344,Proposed actions with respect to causes and effects of declining aircraft readiness rates,Operation and Maintenance,262,,Human,0.0000,0.0000,1.0000,1,0,0,1,low
349,Limitation on use of funds to establish or expand Space Force Special Operations Component Command,Operation and Maintenance,362,,Human,0.0000,0.0000,1.0000,1,0,0,1,low
350,Pilot program for data-enabled ground vehicle maintenance,Operation and Maintenance,279,,Human,0.0000,0.0000,1.0000,0,0,0,0,low
351,Modernization of the organic industrial base of the Army,Operation and Maintenance,325,,Human,0.0000,0.0000,1.0000,1,0,0,1,low
2654,Aircraft safety: requirements for certain highly trafficked domestic airspace,Operation and Maintenance,340,,Human,0.0000,0.0000,1.0000,1,0,0,1,low
374,Establishment of Army museum system,Operation and Maintenance,319,,Human,0.0000,0.0000,1.0000,1,0,0,1,low
376,Establishment of Air Force and Space Force Museum System,Operation and Maintenance,364,,Human,0.0000,0.0000,1.0000,1,0,0,1,low
382,Initiative to control spread of greater banded hornet in Guam,Operation and Maintenance,293,,Human,0.0000,0.0000,1.0000,1,0,0,1,low
384,"Limitation on transformation by the Army of primary helicopter training program at Fort Rucker, Alabama",Operation and Maintenance,307,,Human,0.0000,0.0000,1.0000,1,0,0,1,low
7715,Army museum system,Operation and Maintenance,293,,AI,1.0000,0.0000,0.0000,1,1,0,0,low
269C,Eligibility of former officers to compete for certain positions,National Oceanic and Atmospheric Administration,381,Fully Human Written,Human,0.0000,0.0000,1.0000,1,0,0,1,low
26,Chaplain Corps and Chief of Chaplains,Matters Relating to Elements of the Intelligence Community,475,Fully Human Written,Human,0.0000,0.0000,1.0000,2,0,0,2,low
2802,Facility construction or repair: transactions other than contracts and grants,Military Construction General Provisions,512,AI Detected,Mixed,0.3115,0.0000,0.6885,2,1,0,1,low
2803,Requirement for the military departments to develop and update a 20-year infrastructure improvement plan,Military Construction General Provisions,476,Fully Human Written,Human,0.0000,0.0000,1.0000,2,0,0,2,low
2804,Improvements to water management and security on military installations,Military Construction General Provisions,1519,Fully Human Written,Human,0.0000,0.0000,1.0000,5,0,0,5,medium
2808a,Facility construction or repair: transactions other than contracts and grants,Military Construction General Provisions,448,"Mostly Human, AI Detected",Mixed,0.2983,0.0000,0.7017,2,1,0,1,low
2809,Authority to use accelerated design-build and progressive design-build procedures for military construction projects,Military Construction General Provisions,710,Fully AI Generated,AI,1.0000,0.0000,0.0000,2,2,0,0,low
2814,Multiyear contracting authority for certain military construction projects,Military Construction General Provisions,441,Fully Human Written,Human,0.0000,0.0000,1.0000,2,0,0,2,low
2815,"Guidance for military construction projects for innovation, research, development, test, and evaluation",Military Construction General Provisions,235,,Human,0.0000,0.0000,1.0000,1,0,0,1,low
2816,Authorization for cost-plus-incentive-fee contracts for certain Shipyard Infrastructure Optimization Program military construction projects,Military Construction General Provisions,233,,Human,0.0000,0.0000,1.0000,1,0,0,1,low
2820,Development of infrastructure improvement plan for each military department,Military Construction General Provisions,438,Fully Human Written,Human,0.0000,0.0000,1.0000,2,0,0,2,low
2826,Application of certain authorities and standards to historic military housing and associated historic properties of the Department of Defense,Military Construction General Provisions,1308,Fully Human Written,Human,0.0000,0.0000,1.0000,4,0,0,4,medium
2827,Improvement of administration of military unaccompanied housing,Military Construction General Provisions,456,Fully Human Written,Human,0.0000,0.0000,1.0000,2,0,0,2,low
2829,Pilot program for emerging technologies for moisture control and mitigation,Military Construction General Provisions,465,Fully Human Written,Human,0.0000,0.0000,1.0000,2,0,0,2,low
2831,Inspections by qualified home inspector of privatized and Government-owned military housing,Military Construction General Provisions,377,Fully AI Generated,AI,1.0000,0.0000,0.0000,2,2,0,0,low
2832,"Plan to improve accuracy, integration, and interoperability of Department of Defense data with respect to real property, infrastructure, and military unaccompanied housing",Military Construction General Provisions,625,Fully Human Written,Human,0.0000,0.0000,1.0000,2,0,0,2,low
2850,Master plans for Service Academies,Military Construction General Provisions,433,Fully Human Written,Human,0.0000,0.0000,1.0000,2,0,0,2,low
2851,Annual report on cost premium for construction of certain facilities,Military Construction General Provisions,425,Fully AI Generated,AI,1.0000,0.0000,0.0000,2,2,0,0,low
2852,Implementation of Comptroller General recommendations relating to critical military housing supply and affordability,Military Construction General Provisions,508,Fully Human Written,Human,0.0000,0.0000,1.0000,2,0,0,2,low
2853,Plan for deploying private fifth generation and future generation Open Radio Access Network architecture on Department of Defense military installations,Military Construction General Provisions,540,Fully Human Written,Human,0.0000,0.0000,1.0000,2,0,0,2,low
2861,Historical marker commemorating effects of radiation exposure at Holloman Air Force Base and White Sands Missile Range,Military Construction General Provisions,384,Fully Human Written,Human,0.0000,0.0000,1.0000,1,0,0,1,low
2866a,Risk-based approach to water management and water security at military installations,Military Construction General Provisions,1453,Fully Human Written,Human,0.0000,0.0000,1.0000,5,0,0,5,medium
2867,"Land conveyance, former Curtis Bay Depot, Maryland",Military Construction General Provisions,517,Fully Human Written,Human,0.0000,0.0000,1.0000,2,0,0,2,low
2868,"Land conveyance, Sigsbee Park Annex, Naval Air Station, Key West, Florida",Military Construction General Provisions,265,Fully Human Written,Human,0.0000,0.0000,1.0000,1,0,0,1,low
2883,Joint base facility management of Department of Defense,Military Construction General Provisions,278,,Human,0.0000,0.0000,1.0000,1,0,0,1,low
2884,Designation of official responsible for coordination of defense sites within area of responsibility of Joint Region Marianas,Military Construction General Provisions,288,,Human,0.0000,0.0000,1.0000,1,0,0,1,low
2889,Consideration of modular construction methods for military construction projects with protective design elements,Military Construction General Provisions,270,,Human,0.0000,0.0000,1.0000,1,0,0,1,low
2887,Pilot program on use of advanced manufacturing construction technologies at military installations,Military Construction General Provisions,472,Fully Human Written,Human,0.0000,0.0000,1.0000,2,0,0,2,low
2888,Pilot program on procurement of utility services for installations of the Department of Defense through areawide contracts,Military Construction General Provisions,443,Fully Human Written,Human,0.0000,0.0000,1.0000,2,0,0,2,low
306141,Application of certain authorities and standards to historic military housing and associated historic properties of the Department of the Army,Military Construction General Provisions,359,Fully Human Written,Human,0.0000,0.0000,1.0000,2,0,0,2,low
306142,Application of certain authorities and standards to historic military housing and associated historic properties of the Department of the Navy and the Department of the Air Force,Military Construction General Provisions,437,Fully Human Written,Human,0.0000,0.0000,1.0000,2,0,0,2,low
306A,Designation of a foreign country as a State Sponsor of Unlawful or Wrongful Detention,Foreign Affairs Matters,1436,Fully Human Written,Human,0.0000,0.0000,1.0000,5,0,0,5,medium
3102,Objectives of the defense acquisition system,Acquisition Reform,309,Fully Human Written,Human,0.0000,0.0000,1.0000,1,0,0,1,low
3113,Stockpile responsiveness and rapid capabilities programs of the National Nuclear Security Administration,Department of Energy National Security Programs,523,Fully Human Written,Human,0.0000,0.0000,1.0000,2,0,0,2,low
3124,Office of Environmental Management program-wide performance metrics for reducing risk,Department of Energy National Security Programs,484,Fully Human Written,Human,0.0000,0.0000,1.0000,2,0,0,2,low
3125,Office of Environmental Management integrated radioactive waste disposal planning and optimization,Department of Energy National Security Programs,563,Fully Human Written,Human,0.0000,0.0000,1.0000,2,0,0,2,low
3128,Consultation requirement with respect to transfer to private entities of plutonium or plutonium materials; report,Department of Energy National Security Programs,425,Fully Human Written,Human,0.0000,0.0000,1.0000,2,0,0,2,low
317,Provision of alternative drinking water to households whose private drinking water is contaminated with perfluorooctanesulfonic acid and perfluorooctanoic acid substances from Department of Defense activities,Operation and Maintenance,555,Fully Human Written,Human,0.0000,0.0000,1.0000,2,0,0,2,low
317,Special Advisor to Commandant for Tribal and Native Hawaiian Affairs,"Organization, Authorities, Acquisition, and Personnel of the Coast Guard",505,Fully Human Written,Human,0.0000,0.0000,1.0000,2,0,0,2,low
318,Judge Advocate General; Deputy Judge Advocate General: appointment; duties,"Organization, Authorities, Acquisition, and Personnel of the Coast Guard",563,Fully Human Written,Human,0.0000,0.0000,1.0000,2,0,0,2,low
318,Responsibilities of executive agent for installation and operational nuclear energy,Operation and Maintenance,1093,Fully Human Written,Human,0.0000,0.0000,1.0000,3,0,0,3,medium
319,Establishment of Advanced Nuclear Transition Working Group,Operation and Maintenance,737,Fully Human Written,Human,0.0000,0.0000,1.0000,3,0,0,3,medium
320,Department of Air Force program of record for commercial weather data,Operation and Maintenance,259,Fully Human Written,Human,0.0000,0.0000,1.0000,1,0,0,1,low
321,Pilot program on Navy installation nuclear energy,Operation and Maintenance,787,Fully Human Written,Human,0.0000,0.0000,1.0000,2,0,0,2,low
322,Strategy to accelerate remediation of contamination from perfluoroalkyl substances and polyfluoroalkyl substances,Operation and Maintenance,452,Fully Human Written,Human,0.0000,0.0000,1.0000,2,0,0,2,low
328a,Active Guard and Reserve duty: State disaster response duty,Military Personnel Policy,535,Fully Human Written,Human,0.0000,0.0000,1.0000,2,0,0,2,low
333,Training courses on workings of Congress,"Organization, Authorities, Acquisition, and Personnel of the Coast Guard",1097,Fully Human Written,Human,0.0000,0.0000,1.0000,4,0,0,4,medium
334,Designation of senior officials responsible for integration of global contested logistics posture management,Operation and Maintenance,790,Fully Human Written,Human,0.0000,0.0000,1.0000,3,0,0,3,medium
336,Responsibilities for oversight of certain defense personal property matters,Operation and Maintenance,531,Fully Human Written,Human,0.0000,0.0000,1.0000,2,0,0,2,low
342,Joint Strike Fighter sustainment,Operation and Maintenance,489,Fully Human Written,Human,0.0000,0.0000,1.0000,2,0,0,2,low
343,Depot-level maintenance coordination in multinational exercises,Operation and Maintenance,512,Fully Human Written,Human,0.0000,0.0000,1.0000,2,0,0,2,low
345,Technology enhancement for surface ship maintenance,Operation and Maintenance,708,AI Detected,Mixed,0.4630,0.0000,0.5370,3,1,0,2,medium
346,Oversight requirements for contracts relating to relocation logistics for household goods,Operation and Maintenance,609,AI Detected,Mixed,0.5329,0.0000,0.4671,2,1,0,1,low
347,Integration of commercially available artificial intelligence capabilities into logistics operations,Operation and Maintenance,478,Fully Human Written,Human,0.0000,0.0000,1.0000,2,0,0,2,low
348,Pilot program on Army depot and arsenal workload sustainment,Operation and Maintenance,478,Fully Human Written,Human,0.0000,0.0000,1.0000,2,0,0,2,low
3501,Authorization of appropriations for Maritime Administration,Maritime Administration,688,Fully Human Written,Human,0.0000,0.0000,1.0000,3,0,0,3,medium
3605,Authority to acquire consumption-based solutions,Acquisition Reform,355,Fully Human Written,Human,0.0000,0.0000,1.0000,1,0,0,1,low
363,Reports on munitions response projects at sites formerly used by the Department of Defense,Operation and Maintenance,340,Fully Human Written,Human,0.0000,0.0000,1.0000,1,0,0,1,low
364,Report on critical munitions required for simultaneous conflicts,Operation and Maintenance,639,Fully Human Written,Human,0.0000,0.0000,1.0000,2,0,0,2,low
373,Manned rotary wing aircraft safety,Operation and Maintenance,624,Fully Human Written,Human,0.0000,0.0000,1.0000,2,0,0,2,low
375,Establishment of United States Navy Museum System,Operation and Maintenance,412,Fully Human Written,Human,0.0000,0.0000,1.0000,2,0,0,2,low
378,Minimum standards for military working dog kennels and facilities,Operation and Maintenance,535,Fully Human Written,Human,0.0000,0.0000,1.0000,2,0,0,2,low
379,Restroom access at military installations for certain transportation service providers,Operation and Maintenance,479,Fully Human Written,Human,0.0000,0.0000,1.0000,2,0,0,2,low
383,Reserve mobilization exercise to assess the capability of the Armed Forces to respond to a high-intensity contingency in the Indo-Pacific region,Operation and Maintenance,578,Fully AI Generated,AI,1.0000,0.0000,0.0000,2,2,0,0,low
3864,Assumption of uninsurable risk on certain contracts,"Acquisition Policy, Acquisition Management, and Related Matters",293,,Human,0.0000,0.0000,1.0000,1,0,0,1,low
801,Assumption of uninsurable risk on certain contracts,"Acquisition Policy, Acquisition Management, and Related Matters",368,,Human,0.0000,0.0000,1.0000,1,0,0,1,low
4101,Procurement,Procurement,5842,Fully Human Written,Human,0.0000,0.0000,1.0000,55,0,0,55,high
411,End strengths for Selected Reserve,Military Personnel Authorizations,248,Fully Human Written,Human,0.0000,0.0000,1.0000,1,0,0,1,low
4145,"Program for the enhancement of the research, development, test, and evaluation centers of the Department of Defense","Research, Development, Test, and Evaluation",453,Fully Human Written,Human,0.0000,0.0000,1.0000,2,0,0,2,low
4225,Rapid capabilities program,Department of Energy National Security Programs,357,,Human,0.0000,0.0000,1.0000,1,0,0,1,low
4816,Appropriate scoping of artificial intelligence research within the Administration,Department of Energy National Security Programs,228,,Human,0.0000,0.0000,1.0000,0,0,0,0,low
6103,Management structure for nuclear security enterprise,Department of Energy National Security Programs,320,,Human,0.0000,0.0000,1.0000,1,0,0,1,low
6111,Stockpile stewardship program,Department of Energy National Security Programs,300,,Human,0.0000,0.0000,1.0000,1,0,0,1,low
6112,Portfolio management framework for National Nuclear Security Administration,Department of Energy National Security Programs,242,,Human,0.0000,0.0000,1.0000,0,0,0,0,low
6116,Stockpile management program,Department of Energy National Security Programs,345,,Human,0.0000,0.0000,1.0000,0,0,0,0,low
4301,Operation and maintenance,Operation and Maintenance,3012,Fully Human Written,Human,0.0000,0.0000,1.0000,31,0,0,31,high
430e,Vendor support to clandestine activities,"Space Activities, Strategic Programs, and Intelligence Matters",401,Fully Human Written,Human,0.0000,0.0000,1.0000,2,0,0,2,low
4323,Sustainment reviews,Acquisition Reform,419,Fully Human Written,Human,0.0000,0.0000,1.0000,2,0,0,2,low
4324,Life-cycle management and product support,Acquisition Reform,965,Fully Human Written,Human,0.0000,0.0000,1.0000,4,0,0,4,medium
4501,Other authorizations,Other Authorizations,364,Fully Human Written,Human,0.0000,0.0000,1.0000,4,0,0,4,medium
4601,Military construction,Military Construction,6053,Fully Human Written,Human,0.0000,0.0000,1.0000,38,0,0,38,high
4664,Requirements relating to long-term concessions agreements with certain retailers,"Acquisition Policy, Acquisition Management, and Related Matters",582,Fully Human Written,Human,0.0000,0.0000,1.0000,2,0,0,2,low
4701,Department of Energy National Security programs,Department of Energy National Security Programs,1430,Fully Human Written,Human,0.0000,0.0000,1.0000,11,0,0,11,high
4711,Abandonment of vessels prohibited,Shipping and Navigation,436,Fully Human Written,Human,0.0000,0.0000,1.0000,2,0,0,2,low
4712,Inventory of abandoned vessels,Shipping and Navigation,244,Fully Human Written,Human,0.0000,0.0000,1.0000,1,0,0,1,low
4865,Prohibition on acquisition of advanced batteries composed of materials from certain foreign sources,"Acquisition Policy, Acquisition Management, and Related Matters",735,Fully Human Written,Human,0.0000,0.0000,1.0000,3,0,0,3,medium
500g,Integration of electronic warfare into Tier 1 and Tier 2 joint training exercises,"Space Activities, Strategic Programs, and Intelligence Matters",459,Fully Human Written,Human,0.0000,0.0000,1.0000,2,0,0,2,low
501,Space Force general officer management,Military Personnel Policy,744,Fully Human Written,Human,0.0000,0.0000,1.0000,2,0,0,2,low
504,Chaplains: career flexibility; detail as students at schools for education required for appointment,Military Personnel Policy,1404,Fully Human Written,Human,0.0000,0.0000,1.0000,4,0,0,4,medium
508,Establishment of blast safety officer positions,Military Personnel Policy,336,Fully Human Written,Human,0.0000,0.0000,1.0000,1,0,0,1,low
5107,Quarterly acquisition reports and major acquisition program risk assessment,Coast Guard,599,Fully Human Written,Human,0.0000,0.0000,1.0000,2,0,0,2,low
511,Retention of certain records,"Organization, Authorities, Acquisition, and Personnel of the Coast Guard",308,,Human,0.0000,0.0000,1.0000,1,0,0,1,low
552,Discontinuance of aid to navigation,"Organization, Authorities, Acquisition, and Personnel of the Coast Guard",268,,Human,0.0000,0.0000,1.0000,1,0,0,1,low
7262,Policy on methods to reduce incentives for illicit maritime drug trafficking,"Organization, Authorities, Acquisition, and Personnel of the Coast Guard",298,,Human,0.0000,0.0000,1.0000,1,0,0,1,low
7266,Report on impacts of joint travel regulations on members of Coast Guard who rely on ferry systems,"Organization, Authorities, Acquisition, and Personnel of the Coast Guard",296,,Human,0.0000,0.0000,1.0000,1,0,0,1,low
7268,Report on and expansion of Coast Guard Junior Reserve Officers’ Training Corps program,"Organization, Authorities, Acquisition, and Personnel of the Coast Guard",235,,Human,0.0000,0.0000,1.0000,0,0,0,0,low
512,National Guard: Active Guard and Reserve duty in response to a State disaster,Military Personnel Policy,606,Fully Human Written,Human,0.0000,0.0000,1.0000,2,0,0,2,low
5143,Ambassador-at-Large for the Arctic,Organization and operations,1798,Fully Human Written,Human,0.0000,0.0000,1.0000,5,0,0,5,medium
5144,Ambassador-at-Large for the Indian Ocean region,Organization and operations,242,,Human,0.0000,0.0000,1.0000,1,0,0,1,low
5162,Bureau of International Organization Affairs,Organization and operations,230,,Human,0.0000,0.0000,1.0000,1,0,0,1,low
5148,Countering PRC Influence Fund Unit,Organization and operations,659,Fully Human Written,Human,0.0000,0.0000,1.0000,2,0,0,2,low
515,Study and report on members of the reserve components: consideration of amount of time of service in activation; authority to waive limitation on release from active duty,Military Personnel Policy,332,Fully Human Written,Human,0.0000,0.0000,1.0000,1,0,0,1,low
5160,Countering Russian Influence Fund Unit,Organization and operations,717,Fully Human Written,Human,0.0000,0.0000,1.0000,2,0,0,2,low
5172,Support for congressional delegations,Organization and operations,253,,Human,0.0000,0.0000,1.0000,1,0,0,1,low
5173,Notification requirements for authorized and ordered departures,Organization and operations,334,,Human,0.0000,0.0000,1.0000,1,0,0,1,low
